{
  "id": "ccgm/testing",
  "name": "Testing Audit",
  "version": "1.1.0",
  "applies_when": ["always"],
  "tags": ["testing", "coverage", "quality"],
  "severity_floor": "low",
  "tools": [],
  "checks": [
    {
      "id": "testing/missing-test-file",
      "severity": "medium",
      "confidence": "high",
      "detection": "llm",
      "auto_fixable": false
    },
    {
      "id": "testing/no-assertions",
      "severity": "high",
      "confidence": "high",
      "detection": "llm",
      "auto_fixable": false
    },
    {
      "id": "testing/missing-edge-cases",
      "severity": "low",
      "confidence": "low",
      "detection": "llm",
      "auto_fixable": false
    },
    {
      "id": "testing/sleep-based-flake",
      "severity": "medium",
      "confidence": "medium",
      "detection": "llm",
      "auto_fixable": false
    },
    {
      "id": "testing/only-or-skip-committed",
      "severity": "high",
      "confidence": "high",
      "detection": "tool",
      "tool": "grep",
      "auto_fixable": false
    },
    {
      "id": "testing/mock-not-behavior",
      "severity": "medium",
      "confidence": "low",
      "detection": "llm",
      "auto_fixable": false
    },
    {
      "id": "testing/test-only-prod-method",
      "severity": "medium",
      "confidence": "medium",
      "detection": "llm",
      "auto_fixable": false
    }
  ]
}
