{
  "id": "ccgm/api-contract",
  "name": "API & Contract Audit",
  "version": "1.0.0",
  "applies_when": ["language:javascript"],
  "tags": ["api", "security", "validation", "contract"],
  "severity_floor": "low",
  "tools": [],
  "checks": [
    {
      "id": "api/missing-input-validation",
      "severity": "high",
      "confidence": "medium",
      "detection": "llm",
      "auto_fixable": false
    },
    {
      "id": "api/mass-assignment",
      "severity": "high",
      "confidence": "medium",
      "detection": "llm",
      "auto_fixable": false
    },
    {
      "id": "api/unbounded-list",
      "severity": "medium",
      "confidence": "medium",
      "detection": "llm",
      "auto_fixable": false
    },
    {
      "id": "api/missing-versioning",
      "severity": "low",
      "confidence": "medium",
      "detection": "llm",
      "auto_fixable": false
    }
  ]
}
