{
  "id": "ccgm/go-security",
  "name": "Go Security",
  "version": "1.0.0",
  "applies_when": ["language:go"],
  "tags": ["go", "security", "vulnerabilities"],
  "severity_floor": "low",
  "tools": ["govulncheck", "gosec"],
  "checks": [
    {
      "id": "go/known-vuln",
      "severity": "high",
      "confidence": "high",
      "detection": "tool",
      "tool": "govulncheck",
      "auto_fixable": false
    },
    {
      "id": "go/sql-injection",
      "severity": "critical",
      "confidence": "medium",
      "detection": "hybrid",
      "tool": "gosec",
      "rule": "G201",
      "fallback": "llm",
      "auto_fixable": false
    }
  ]
}
